{
  "batch_id": "MEIHUA-KNOWLEDGE-BATCH-001",
  "workbench_type": "AI_EDITORIAL_DRAFT_PENDING_HUMAN_REVIEW",
  "formal_import_enabled": false,
  "records": [
    {
      "batch_id": "MEIHUA-KNOWLEDGE-BATCH-001",
      "item_id": "H01",
      "item_type": "HEXAGRAM",
      "king_wen_number": 1,
      "hexagram_name": "乾",
      "upper_trigram": "乾",
      "lower_trigram": "乾",
      "line_position": null,
      "line_name": null,
      "canonical_text_from_project": "元亨利貞。",
      "canonical_data_version": "MEIHUA_CANONICAL_TEXTS_V1",
      "canonical_source_name": "王弼《周易注》底本公开镜像（冻结主文本，待逐条人工版本核对）",
      "canonical_source_reference": "https://gist.githubusercontent.com/sui1491/52e8214c8e5f4a189b94f5ea2b8bdb05/raw/d628f824a90d7b41b5149199e0fa0767e030b3af/%E6%98%93%E7%BB%8F%E5%85%A8%E6%96%87",
      "canonical_source_hash": "1227362f37a4cd2a9730efa4462d5538824cfecc9ac98d0969a14cde71af293a",
      "current_cross_check_status": "PENDING_HUMAN_REVIEW",
      "normalization_rules": [
        "trim whitespace",
        "無 → 无",
        "punctuation normalization",
        "special source formatting repair for hexagram 8"
      ],
      "extraction_script_version": "MEIHUA_REVIEW_BATCH_BUILDER_V1",
      "source_comparison": {
        "project_text": "元亨利貞。",
        "ctext_text": "元亨，利貞。",
        "wikisource_text": "元亨。利貞。",
        "character_level_match": false,
        "punctuation_only_difference": true,
        "simplified_traditional_difference": false,
        "substantive_variant_detected": false,
        "variant_notes": "仅检测到标点或空白差异；仍需人工确认。",
        "source_accessed_at": "2026-07-11",
        "human_review_required": true,
        "ctext_url": "https://ctext.org/book-of-changes/qian",
        "wikisource_url": "https://zh.wikisource.org/zh-hant/%E5%91%A8%E6%98%93/%E4%B9%BE"
      },
      "current_knowledge_status": "DRAFT",
      "workbench_status": "READY_FOR_CONTENT_REVIEW",
      "knowledge_evidence": [],
      "human_signoff": null,
      "review_fields": {
        "judgment_paraphrase": "整体具备开创、推进和形成成果的条件，但“利贞”要求方向正当、目标清楚并能持续自律；有力量不等于可以任性推进。",
        "core_theme": "主动创造、持续进取，并以原则约束力量。",
        "situation_pattern": "资源、能力或行动意愿较强，事情有向上展开的空间；关键不在于是否敢做，而在于方向、节奏和责任能否长期一致。",
        "favorable_conditions": "目标明确；行动与承诺一致；能够持续投入；愿意接受规则、协作和现实反馈。",
        "risk_conditions": "自信膨胀、急于证明、把强势当执行力，或在条件尚未成熟时过度扩张。",
        "action_tendency": "可以主动筹划和分阶段推进，但应先确认方向、边界与长期承受力。",
        "relationship_boundaries": "可说明关系中存在较强的主动性或发展动力；不能据此断言对方一定回应、复合或进入承诺。",
        "career_boundaries": "可用于解释开新局、承担责任和主动争取；不能推断必然升职、创业成功或权力上升。",
        "cooperation_boundaries": "适合目标和权责清楚的合作；需要防止单方控制、责任失衡和只求速度。",
        "prohibited_inferences": [
          "不得解释为“只要主动就一定成功”",
          "不得断言对方会被说服、征服或必然接受",
          "不得把强势、控制欲包装成乾卦应有表现",
          "不得承诺升职、创业成功或财富增长"
        ],
        "evidence_direction": "POSITIVE",
        "evidence_strength": "MEDIUM",
        "reviewer_notes": "卦辞极简，解释必须保留“利贞”的条件性；不把“元亨利贞”机械拆成四个固定吉利标签。",
        "review_decision": "建议形成DRAFT候选，待产品负责人确认语气后再进入REVIEWED。",
        "literal_paraphrase": null,
        "moving_stage_relationship": null
      },
      "review_card_path": "hexagrams/H01_QIAN.md"
    },
    {
      "batch_id": "MEIHUA-KNOWLEDGE-BATCH-001",
      "item_id": "H01-L1",
      "item_type": "LINE",
      "king_wen_number": 1,
      "hexagram_name": "乾",
      "upper_trigram": "乾",
      "lower_trigram": "乾",
      "line_position": 1,
      "line_name": "初",
      "canonical_text_from_project": "潛龍勿用。",
      "canonical_data_version": "MEIHUA_CANONICAL_TEXTS_V1",
      "canonical_source_name": "王弼《周易注》底本公开镜像（冻结主文本，待逐条人工版本核对）",
      "canonical_source_reference": "https://gist.githubusercontent.com/sui1491/52e8214c8e5f4a189b94f5ea2b8bdb05/raw/d628f824a90d7b41b5149199e0fa0767e030b3af/%E6%98%93%E7%BB%8F%E5%85%A8%E6%96%87",
      "canonical_source_hash": "2efeb0a408474c8ae63170884b0dc957f02e8486322a2af1620c70d1dd891c76",
      "current_cross_check_status": "PENDING_HUMAN_REVIEW",
      "normalization_rules": [
        "trim whitespace",
        "無 → 无",
        "punctuation normalization",
        "special source formatting repair for hexagram 8"
      ],
      "extraction_script_version": "MEIHUA_REVIEW_BATCH_BUILDER_V1",
      "source_comparison": {
        "project_text": "潛龍勿用。",
        "ctext_text": "潛龍，勿用。",
        "wikisource_text": "潛龍勿用。",
        "character_level_match": false,
        "punctuation_only_difference": true,
        "simplified_traditional_difference": false,
        "substantive_variant_detected": false,
        "variant_notes": "仅检测到标点或空白差异；仍需人工确认。",
        "source_accessed_at": "2026-07-11",
        "human_review_required": true,
        "ctext_url": "https://ctext.org/book-of-changes/qian",
        "wikisource_url": "https://zh.wikisource.org/zh-hant/%E5%91%A8%E6%98%93/%E4%B9%BE"
      },
      "current_knowledge_status": "DRAFT",
      "workbench_status": "READY_FOR_CONTENT_REVIEW",
      "knowledge_evidence": [],
      "human_signoff": null,
      "review_fields": {
        "judgment_paraphrase": null,
        "core_theme": "潜藏蓄力、等待条件、暂不显用。",
        "situation_pattern": "事情刚开始，外部条件、身份、能力或支持尚不足以承载全面行动。",
        "favorable_conditions": "继续准备；积累能力和证据；观察环境；设定启动条件；不因暂时沉默否定长期潜力。",
        "risk_conditions": "为了证明自己而过早暴露、承诺或推进；把等待变成消极拖延；反复起卦替代准备。",
        "action_tendency": "暂缓公开或高成本行动，把重点放在准备、验证和等待明确启动信号。",
        "relationship_boundaries": "可提示不宜急于表白、逼问或要求承诺；不能断言对方在暗中爱你或未来一定出现。",
        "career_boundaries": "可提示暂不贸然跳槽、创业或公开竞争；不能解释为永远没有机会。",
        "cooperation_boundaries": "合作尚宜尽调、试探和准备，不宜过早绑定资源或做不可逆承诺。",
        "prohibited_inferences": [
          "不得断言对方在隐藏感情",
          "不得承诺等待后必然成功",
          "不得把“勿用”解释为永久不行动",
          "不得以卦象代替现实启动条件"
        ],
        "evidence_direction": "MIXED",
        "evidence_strength": "STRONG",
        "reviewer_notes": "“勿用”是阶段性行动限制，不是对人的否定，也不是长期结果判断。",
        "review_decision": "建议形成DRAFT候选，待产品负责人确认语气后再进入REVIEWED。",
        "literal_paraphrase": "力量仍处在潜藏、积累的位置，现在不是公开施展或强行推进的时候。",
        "moving_stage_relationship": "初爻对应萌芽阶段；能力或意愿可能已经存在，但尚未进入适合承担外部结果的位置。"
      },
      "review_card_path": "lines/H01_L1.md"
    },
    {
      "batch_id": "MEIHUA-KNOWLEDGE-BATCH-001",
      "item_id": "H02",
      "item_type": "HEXAGRAM",
      "king_wen_number": 2,
      "hexagram_name": "坤",
      "upper_trigram": "坤",
      "lower_trigram": "坤",
      "line_position": null,
      "line_name": null,
      "canonical_text_from_project": "元亨，利牝馬之貞。君子有攸往，先迷後得，主利，西南得朋，東北喪朋，安貞吉。",
      "canonical_data_version": "MEIHUA_CANONICAL_TEXTS_V1",
      "canonical_source_name": "王弼《周易注》底本公开镜像（冻结主文本，待逐条人工版本核对）",
      "canonical_source_reference": "https://gist.githubusercontent.com/sui1491/52e8214c8e5f4a189b94f5ea2b8bdb05/raw/d628f824a90d7b41b5149199e0fa0767e030b3af/%E6%98%93%E7%BB%8F%E5%85%A8%E6%96%87",
      "canonical_source_hash": "7829f4d5a1b4c131ab65212f575b0f894117e02871f5e0b6abf02d9b3033ddc1",
      "current_cross_check_status": "PENDING_HUMAN_REVIEW",
      "normalization_rules": [
        "trim whitespace",
        "無 → 无",
        "punctuation normalization",
        "special source formatting repair for hexagram 8"
      ],
      "extraction_script_version": "MEIHUA_REVIEW_BATCH_BUILDER_V1",
      "source_comparison": {
        "project_text": "元亨，利牝馬之貞。君子有攸往，先迷後得，主利，西南得朋，東北喪朋，安貞吉。",
        "ctext_text": "元亨，利牝馬之貞。君子有攸往，先迷後得主，利西南得朋，東北喪朋。安貞，吉。",
        "wikisource_text": "元亨。利牝馬之貞。君子有攸往，先迷後得主。利西南得朋，東北喪朋。安貞，吉。",
        "character_level_match": false,
        "punctuation_only_difference": true,
        "simplified_traditional_difference": false,
        "substantive_variant_detected": false,
        "variant_notes": "仅检测到标点或空白差异；仍需人工确认。",
        "source_accessed_at": "2026-07-11",
        "human_review_required": true,
        "ctext_url": "https://ctext.org/book-of-changes/kun",
        "wikisource_url": "https://zh.wikisource.org/zh-hant/%E5%91%A8%E6%98%93/%E5%9D%A4"
      },
      "current_knowledge_status": "DRAFT",
      "workbench_status": "READY_FOR_CONTENT_REVIEW",
      "knowledge_evidence": [],
      "human_signoff": null,
      "review_fields": {
        "judgment_paraphrase": "顺利来自稳定承载、配合客观条件和守正持续；开始时可能一度失去方向，但找到主线、选择合适同伴并保持安定后，事情才更容易展开。",
        "core_theme": "承载、顺势、稳定执行，并在配合中保持原则。",
        "situation_pattern": "当前更需要接纳现实、整合资源、支持长期过程，而不是抢先主导或强行改变全部条件。",
        "favorable_conditions": "角色与边界清楚；节奏稳定；能够倾听和配合；选择价值观与目标相容的人或环境。",
        "risk_conditions": "把顺势误解为盲从，把承载误解为无限忍耐，或因为害怕冲突而失去判断和边界。",
        "action_tendency": "先确认方向和责任，再以稳定、持续、可承受的方式执行；支持别人不等于放弃自己的判断。",
        "relationship_boundaries": "可说明关系更需要耐心、照顾现实和稳定回应；不能推断某一性别必须顺从，也不能要求一方无限牺牲。",
        "career_boundaries": "适合支持系统、运营执行、资源整合和长期建设；不能推断只能做辅助岗位或不适合领导。",
        "cooperation_boundaries": "有利于互补、稳定和长期合作；前提是权责明确，不以单方承受全部成本维持表面和谐。",
        "prohibited_inferences": [
          "不得把坤卦解释为女性、弱势或必须服从",
          "不得鼓励无边界忍耐或自我牺牲",
          "不得断言只要等待就会自动得到结果",
          "不得把配合解释为放弃判断和主动权"
        ],
        "evidence_direction": "POSITIVE",
        "evidence_strength": "MEDIUM",
        "reviewer_notes": "“牝马之贞”按稳定、顺势且有方向的持续性解释，不引入性别刻板印象。",
        "review_decision": "建议形成DRAFT候选，待产品负责人确认语气后再进入REVIEWED。",
        "literal_paraphrase": null,
        "moving_stage_relationship": null
      },
      "review_card_path": "hexagrams/H02_KUN.md"
    },
    {
      "batch_id": "MEIHUA-KNOWLEDGE-BATCH-001",
      "item_id": "H02-L6",
      "item_type": "LINE",
      "king_wen_number": 2,
      "hexagram_name": "坤",
      "upper_trigram": "坤",
      "lower_trigram": "坤",
      "line_position": 6,
      "line_name": "上",
      "canonical_text_from_project": "龍戰于野，其血玄黃。",
      "canonical_data_version": "MEIHUA_CANONICAL_TEXTS_V1",
      "canonical_source_name": "王弼《周易注》底本公开镜像（冻结主文本，待逐条人工版本核对）",
      "canonical_source_reference": "https://gist.githubusercontent.com/sui1491/52e8214c8e5f4a189b94f5ea2b8bdb05/raw/d628f824a90d7b41b5149199e0fa0767e030b3af/%E6%98%93%E7%BB%8F%E5%85%A8%E6%96%87",